Title,Investigation of the thermal responses under gas channel and land inside proton exchange membrane fuel cell with assembly pressureFirst,,
First,Wang Q.,SCOPUS,School of Automotive Studies & Clean Energy Automotive Engineering Center Tongji University (Jiading Campus) 4800 Caoan Road Shanghai 201804 China
Last,"Ming, Pingwen",SCOPUS,School of Automotive Studies & Clean Energy Automotive Engineering Center Tongji University (Jiading Campus) 4800 Caoan Road Shanghai 201804 China
,,,
Title,Study on Water Cooling Performance of IGBT Module in Wind Power ConverterFirst,,
First,Yang F.,SCOPUS,Nari Technology Department Co. Ltd Nanjing China
Last,Wang Z.,SCOPUS,Nari Technology Department Co. Ltd Nanjing China
,,,
Title,Study on Environmental Adaptability of Metal Plate Fuel CellFirst,,
First,"Wang, Hailiang",SCOPUS,School of Energy and Environmental Engineering University of Science and Technology Beijing Beijing 100083 China
Last,Gao J.,SCOPUS,Xinxing Jihua Science and Technology Development Co
,,,
Title,BIPOLAR ELECTRODEPOSITION OF SPONGY LEAD FROM ALKALINE SOLUTIONS ON A FLOW WIRE CATHODEFirst,,
First,Zarochentsev V.M.,SCOPUS,Northern Caucasian Institute of Mining and Metallurgy (State Technological University) Vladikavkaz Russian Federation
Last,Kovaleva M.A.,SCOPUS,Vladikavkaz Branch of the Finance University under the Government of the Russian Federation Vladikavkaz Russian Federation
,,,
Title,Investigation of the effect of carbon post- vs pre-coated metallic bipolar plates for PEMFCs ? start-up and shut-downFirst,,
First,M?ller M.-V.,SCOPUS,Cellcentric GmbH & Co. KG Neue Strae 95 Kirchheim / Teck-Nabern 73230 Germany Institute of Energy Technology Faculty of Engineering University Duisburg-Essen Germany
Last,"Schw?mmlein, Jan N.",SCOPUS,Cellcentric GmbH & Co. KG Neue Strae 95 Kirchheim / Teck-Nabern 73230 Germany
,,,
Title,Effect of the Geometric Parameters of the Rib-Channel and Porous Cathode on the Species Distribution in the Cathodes of Protonic Ceramic Fuel Cell StackFirst,,
First,Dai J.,SCOPUS,School of Energy and Power Engineering Jiangsu University of Science and Technology Zhenjiang 212100 China
Last,Chen D.,SCOPUS,School of Energy and Power Engineering Jiangsu University of Science and Technology Zhenjiang 212100 China
,,,
Title,Study of the Degradation in a Unitized Regenerative Fuel CellFirst,,
First,Bhosale A.C.,SCOPUS,Department of Hydro and Renewable Energy Indian Institute of Technology Roorkee Roorkee 247667 India
Last,"Ghosh, Prakash Chandra",SCOPUS,Department of Energy Science and Engineering Indian Institute of Technology Bombay Mumbai 400076 India
,,,
Title,Graphitic regulation of C/Cr composite film for 304 stainless steels bipolar platesFirst,,
First,Wang Y.-H.,SCOPUS,School of Materials and Metallurgy University of Science and Technology Liaoning Anshan 114051 China
Last,Sun Y.-B.,SCOPUS,Dalian Jintaizhengxin technology Co. Ltd. Dalian Liaoning  116600 China
,,,
Title,A comparative study of corrosion resistance evaluation of bipolar plate materials for proton exchange membrane fuel cellFirst,,
First,Leng Y.,SCOPUS,School of Automotive Studies Tongji University 4800 Caoangong Road Shanghai 200092 China New Energy Automotive Engineering Center Tongji University 4800 Caoangong Road Shanghai 200029 China
Last,"Zhang, Cunman",SCOPUS,School of Automotive Studies Tongji University 4800 Caoangong Road Shanghai 200092 China New Energy Automotive Engineering Center Tongji University 4800 Caoangong Road Shanghai 200029 China
,,,
Title,A review of bipolar plate materials and flow field designs in the all-vanadium redox flow batteryFirst,,
First,Gautam R.K.,SCOPUS,Indian Institute of Technology Delhi Hauz-Khas New Delhi  110016 India
Last,Kumar A.,SCOPUS,Thapar Institute of Engineering & Technology Patiala Punjab  147004 India
,,,
Title,Investigation of anodized Ta/Ag coating on magnesium bipolar plate for lightweight proton exchange membrane fuel cellsFirst,,
First,Yan P.,SCOPUS,National Engineering Research Center of Light Alloy Net Forming School of Materials Science and Engineering Shanghai Jiao Tong University Shanghai 200240 China
Last,Zeng X.,SCOPUS,National Engineering Research Center of Light Alloy Net Forming School of Materials Science and Engineering Shanghai Jiao Tong University Shanghai 200240 China Center of Hydrogen Science Shanghai Jiao Tong University Shanghai 200240 China
,,,
Title,Measurement of water concentration along the straight channel of proton exchange membrane fuel cellFirst,,
First,"Han, Jaesu",SCOPUS,Graduate School Chungnam National University Daejeon South Korea
Last,"Yu, Sangseok",SCOPUS,Department of Mechanical Engineering Chungnam National University Daejeon South Korea
,,,
Title,Modeling ammonia-fueled co-flow dual-channel protonic-ceramic fuel cellsFirst,,
First,"Zhu, Huayang",SCOPUS,Department of Mechanical Engineering Colorado School of Mines Golden CO United States
Last,"Kee, Robert J.",SCOPUS,Department of Mechanical Engineering Colorado School of Mines Golden CO United States
,,,
Title,Detection and Analysis of Corrosion and Contact Resistance Faults of TiN and CrN Coatings on 410 Stainless Steel as Bipolar Plates in PEM Fuel CellsFirst,,
First,Forouzanmehr M.,SCOPUS,Department of Mechanical Engineering Shahid Bahonar University of Kerman Kerman 7618868366 Iran
Last,"Chizari, Mahmoud",SCOPUS,School of Physics Engineering and Computer Sciences University of Hertfordshire Hatfield AL10 9AB United Kingdom
,,,
Title,Influence Factors and Current Response of Carbon Cloth Bipolar Plate Electroenhanced Bioreactor (CBEEB) for Nitrogen RemovalFirst,,
First,Kejia W.,SCOPUS,Bio-Energy Research Center Institute of New Rural Development Tongji University Shanghai 201804 China
Last,Bowen W.,SCOPUS,Bio-Energy Research Center Institute of New Rural Development Tongji University Shanghai 201804 China
,,,
Title,An integrated composite structure with reduced electrode / bipolar plate contact resistance for vanadium redox flow batteryFirst,,
First,Jeong K.I.,SCOPUS,Department of Mechanical Engineering Korea Advanced Institute of Science and Technology 291 Daehak-ro Yuseong-gu Daejeon 305?701 South Korea
Last,"Kim, Seongsu",SCOPUS,Department of Mechanical Engineering Korea Advanced Institute of Science and Technology 291 Daehak-ro Yuseong-gu Daejeon 305?701 South Korea
,,,
Title,Life cycle assessment of soluble lead redox flow batteryFirst,,
First,Shittu E.,SCOPUS,Faculty of Science and Engineering Swansea University Bay Campus Swansea UK  SA1 8EN United Kingdom
Last,Baker J.,SCOPUS,Faculty of Science and Engineering Swansea University Bay Campus Swansea UK  SA1 8EN United Kingdom
,,,
Title,An electric-pulse-assisted stamping process towards springback suppression and precision fabrication of micro channelsFirst,,
First,Li C.,SCOPUS,Shanghai Key Laboratory of Digital Manufacture for Thin-Walled Structures Shanghai Jiao Tong University Shanghai 200240 China State Key Laboratory of Mechanical System and Vibration Shanghai Jiao Tong University Shanghai 200240 China
Last,Lai X.,SCOPUS,Shanghai Key Laboratory of Digital Manufacture for Thin-Walled Structures Shanghai Jiao Tong University Shanghai 200240 China State Key Laboratory of Mechanical System and Vibration Shanghai Jiao Tong University Shanghai 200240 China
,,,
Title,Proximal humeral fractures in Finland: Trends in the incidence and methods of treatment between 1997 and 2019First,,
First,Leino O.K.,SCOPUS,Department of Orthopaedics and Traumatology Turku University Hospital TYKS Turku Finland Faculty of Medicine University of Turku Turku Finland
Last,Ekman E.M.,SCOPUS,Department of Orthopaedics and Traumatology Turku University Hospital TYKS Turku Finland Faculty of Medicine University of Turku Turku Finland
,,,
Title,Bipolar Precharger for Hybrid Electrostatic Filtration SystemsFirst,,
First,Chang Y.,SCOPUS,Hubei Key Laboratory of Industrial Fume and Dust Pollution Control Jianghan University Wuhan 430056 China
Last,Jia P.,SCOPUS,School of Resources and Safety Engineering Wuhan Institute of Technology Wuhan 430073 China
,,,
Title,Neuronal identities derived by misexpression of the POU IV sensory determinant in a protovertebrateFirst,,
First,Chacha P.P.,SCOPUS,Lewis-Sigler Institute for Integrative Genomics Princeton University Princeton NJ  08540 United States
Last,Levine M.,SCOPUS,Lewis-Sigler Institute for Integrative Genomics Princeton University Princeton NJ  08540 United States Department of Molecular Biology Princeton University Princeton NJ  08540 United States
,,,
Title,Bio-inspired flow channel designs for proton exchange membrane fuel cells: A reviewFirst,,
First,"Zhang, Shuanyang",SCOPUS,School of Energy and Power Engineering University of Shanghai for Science and Technology Shanghai 200093 China
Last,Talkhoncheh F.K.,SCOPUS,Department of Mechanical Engineering University of Isfahan Isfahan Iran
,,,
Title,Long-term polarization accelerated degradation of nano-thin C/Ti coated SS316L bipolar plates used in polymer electrolyte membrane fuel cellsFirst,,
First,Wang X.-Z.,SCOPUS,State Key Laboratory of Solidification Processing Center of Advanced Lubrication and Seal Materials Northwestern Polytechnical University Shaanxi Xi'an 710072 China
Last,Fan H.-Q.,SCOPUS,State Key Laboratory of Advanced Special Steel School of Materials Science and Engineering Shanghai University 99 Shangda Road Shanghai 200444 China
,,,
Title,"Layout, Packaging, and Efficiency Implications of a 1.7 kV Hybrid Si/SiC Reverse Blocking Switch Module in Soft-Switching Current Source ConvertersFirst",,
First,"Marellapudi, Aniruddh",SCOPUS,Georgia Institute of Technology Center for Distributed Energy Department of Electrical and Computer Engineering Atlanta GA United States
Last,"Divan, Deepak M.",SCOPUS,Georgia Institute of Technology Center for Distributed Energy Department of Electrical and Computer Engineering Atlanta GA United States
,,,
Title,Review of vanadium redox flow battery technology [??????First,,
First,"Qu, Dawei",SCOPUS,College of Automotive Engineering Jilin University Changchun 130022 China
Last,Ma J.-Y.,SCOPUS,College of Automotive Engineering Jilin University Changchun 130022 China
,,,
Title,Behavior of Centromeres during Restitution of the First Meiotic Division in a Wheat?Rye HybridFirst,,
First,Lukaszewski A.,SCOPUS,Department of Botany and Plant Sciences University of California Riverside CA  92521 United States
Last,Lukaszewski A.,SCOPUS,Department of Botany and Plant Sciences University of California Riverside CA  92521 United States
,,,
Title,LITHIUM AND ENDOCRINE DYSFUNCTION [Litio y disfunci?n endocrinaFirst,,
First,Lerena V.S.,SCOPUS,Divisi?n Endocrinolog?a Hospital de Cl?nicas Jos? de San Mart?n Facultad de Medicina Universidad de Buenos Aires Av. C?rdoba 2351 Buenos Aires 1120 Argentina
Last,Rizzo L.F.L.,SCOPUS,Divisi?n Endocrinolog?a Hospital de Cl?nicas Jos? de San Mart?n Facultad de Medicina Universidad de Buenos Aires Av. C?rdoba 2351 Buenos Aires 1120 Argentina
,,,
Title,Bipolar clavicle fractures treatment using medial and lateral double plates A case reportFirst,,
First,Xing H.,SCOPUS,Department of Orthopedics China-Japan Union Hospital of Jilin University Jilin Changchun China
Last,Wang G.,SCOPUS,Department of Orthopedics China-Japan Union Hospital of Jilin University Jilin Changchun China
,,,
Title,Improved X-Band Performance and Reliability of a GaN HEMT with Sunken Source Connected Field Plate DesignFirst,,
First,Bothe K.M.,SCOPUS,RF Device and Process Development Group Wolfspeed Durham NC United States
Last,Noori B.,SCOPUS,RF Device and Process Development Group Wolfspeed Durham NC United States
,,,
Title,CNT sheet as a cathodic functional interlayer in polymer electrolyte membrane fuel cellsFirst,,
First,Kwon O.,SCOPUS,School of Mechanical Engineering Soongsil University 369 Sangdo-ro Dongjak-gu Seoul 06978 South Korea
Last,"Park, Taehyun",SCOPUS,School of Mechanical Engineering Soongsil University 369 Sangdo-ro Dongjak-gu Seoul 06978 South Korea
,,,
Title,Electrochemical Passivation Properties of Valve Transition Metal CarbidesFirst,,
First,"G?hl, Daniel",SCOPUS,Technical University of Darmstadt Department of Chemistry Ernst-Berl-Institut f?r Technische und Makromolekulare Chemie Darmstadt 64287 Germany Department of Interface Chemistry and Surface Engineering Max-Planck-Institut f?r Eisenforschung GmbH D?sseldorf 40237 Germany
Last,"Ledendecker, Marc",SCOPUS,Technical University of Darmstadt Department of Chemistry Ernst-Berl-Institut f?r Technische und Makromolekulare Chemie Darmstadt 64287 Germany
,,,
Title,Concepts for preventing metal dissolution from stainless-steel bipolar plates in PEM fuel cellsFirst,,
First,Novalin T.,SCOPUS,Applied Electrochemistry School of Engineering Sciences in Chemistry Biotechnology and Health KTH Royal Institute of Technology Stockholm SE-100 44 Sweden
Last,"Lindstr?m, Rakel Wreland",SCOPUS,Applied Electrochemistry School of Engineering Sciences in Chemistry Biotechnology and Health KTH Royal Institute of Technology Stockholm SE-100 44 Sweden
,,,
Title,A shorted membrane electrochemical cell powered by hydrogen to remove CO2 from the air feed of hydroxide exchange membrane fuel cellsFirst,,
First,Shi L.,SCOPUS,Department of Chemical and Biomolecular Engineering Center for Catalytic Science and Technology University of Delaware Newark DE United States
Last,"Yan, Yushan",SCOPUS,Department of Chemical and Biomolecular Engineering Center for Catalytic Science and Technology University of Delaware Newark DE United States Versogen Inc. Wilmington DE United States
,,,
Title,Natural-forced cooling and Monte-Carlo multi-objective optimization of mechanical and thermal characteristics of a bipolar plate for use in a proton exchange membrane fuel cellFirst,,
First,Barnoon P.,SCOPUS,Department of Mechanical Engineering Khomeinishahr Branch Islamic Azad University Khomeinishahr Iran
Last,"Eftekhari, S. Ali",SCOPUS,Department of Mechanical Engineering Khomeinishahr Branch Islamic Azad University Khomeinishahr Iran
,,,
Title,Strategies to optimize water management in anion exchange membrane fuel cellsFirst,,
First,Zhang B.,SCOPUS,Department of Chemical Engineering School of Chemical Engineering and Technology Xi'an Jiaotong University Xi'an China
Last,Gao Z.,SCOPUS,Department of Chemical Engineering School of Chemical Engineering and Technology Xi'an Jiaotong University Xi'an China
,,,
Title,Development and comparison of the test methods proposed in the Chinese test specifications for fuel cell electric vehiclesFirst,,
First,Lan H.,SCOPUS,China Automotive Technology & Research Center Co. Ltd (CATARC) Tianjin 300300 China
Last,He Y.,SCOPUS,China Automotive Technology & Research Center Co. Ltd (CATARC) Tianjin 300300 China
,,,
Title,"Materials for Polymer Electrolyte Membrane Fuel Cells (PEMFCs): Electrolyte Membrane, Gas Diffusion Layers and Bipolar PlatesFirst",,
First,Branco C.M.,SCOPUS,University of Birmingham Birmingham United Kingdom
Last,"Du, Shangfeng",SCOPUS,University of Birmingham Birmingham United Kingdom
,,,
Title,Controlling the compactness and sp2 clusters to reduce interfacial damage of amorphous carbon/316L bipolar plates in PEMFCsFirst,,
First,Li H.,SCOPUS,Key Laboratory of Marine Materials and Related Technologies Zhejiang Key Laboratory of Marine Materials and Protective Technologies Ningbo Institute of Materials Technology and Engineering Chinese Academy of Sciences Ningbo 315201 China Center of Materials Science and Optoelectronics Engineering University of Chinese Academy of Sciences Beijing 100049 China
Last,"Wang, Aiying",SCOPUS,Key Laboratory of Marine Materials and Related Technologies Zhejiang Key Laboratory of Marine Materials and Protective Technologies Ningbo Institute of Materials Technology and Engineering Chinese Academy of Sciences Ningbo 315201 China Center of Materials Science and Optoelectronics Engineering University of Chinese Academy of Sciences Beijing 100049 China
,,,
Title,A Triple Bioinspired Surface Based on Perfluorodecyl Trimethoxysilane-Coated ZnO Nanosheets for Self-Driven Water Transport in a Flow ChannelFirst,,
First,"Liu, Zhenning",SCOPUS,Key Laboratory of Bionic Engineering (Ministry of Education) College of Biological and Agricultural Engineering Jilin University Changchun 130022 China
Last,"Lu, Guolong",SCOPUS,Key Laboratory of Bionic Engineering (Ministry of Education) College of Biological and Agricultural Engineering Jilin University Changchun 130022 China
,,,
Title,Conductive and Corrosion-Resistant Properties of Graphitelike Carbon Coating on 6061 Aluminum Alloy Bipolar Plate for Proton Exchange Membrane Fuel Cell [???6061 ?????????First,,
First,Shao W.,SCOPUS,School of Materials Science and Chemical Engineering Xi'an Technological University Xi'an 710021 China
Last,Yang W.,SCOPUS,School of Materials Science and Chemical Engineering Xi'an Technological University Xi'an 710021 China
,,,
Title,Collective Enhancements on Thermal-Electrical and Mechanical Properties of Graphite-Based Composite Bipolar Plates through the Coupled Manipulations of Molding and Impregnation PressuresFirst,,
First,Wang X.,SCOPUS,Moe Key Laboratory of Thermo Fluid Science and Engineering Energy and Power Engineering School Xian Jiaotong University Xian 710049 China
Last,Liu C.,SCOPUS,Shanghai Sinofuelcell Co. Ltd Shanghai 201499 China
,,,
Title,Surface roughness of AISI 1010 and AISI 304 of PEMFC bipolar plates with microscale hydroformed capillary channelsFirst,,
First,Olayinka A.,SCOPUS,Department of Mechanical Engineering University of Louisiana at Lafayette Lafayette LA United States
Last,"Emblom, William J.",SCOPUS,Department of Mechanical Engineering University of Louisiana at Lafayette Lafayette LA United States
,,,
Title,A Model-based Prognosis approach to Proton Exchange Membrane Water Electrolysis SystemFirst,,
First,Prakash O.,SCOPUS,Universit? De Lille CRIStAL UMR CNRS 9189 Villeneuve D'Ascq France
Last,Bressel M.,SCOPUS,CRIStAL UMR CNRS 9189 Yncre? Villeneuve D'Ascq France
,,,
Title,Research on Optimization of Segmented Micro-channel Structure Based on Flow Boiling Heat Transfer Mechanism [????????First,,
First,Yan Q.,SCOPUS,Institute of Thermal Engineering School of Mechanical Electronic and Control Engineering Beijing Jiaotong University Beijing 100044 China Beijing Key Laboratory of Flow and Heat Transfer of Phase Changing in Micro and Small Scale Beijing 100044 China United Technology Center Western Metal Materials Co. Ltd. Xi'an 710018 China
Last,Jia L.,SCOPUS,Institute of Thermal Engineering School of Mechanical Electronic and Control Engineering Beijing Jiaotong University Beijing 100044 China Beijing Key Laboratory of Flow and Heat Transfer of Phase Changing in Micro and Small Scale Beijing 100044 China
,,,
Title,Power Loss Calculation Method for IGBT in Converter Valve Based on Inverse Heat Transfer ProblemFirst,,
First,Liu L.,SCOPUS,Shanghai Jiao Tong University Shanghai China State Grid Zhoushan Power Supply Company Zhoushan China
Last,Tang D.,SCOPUS,Soochow University Suzhou China
,,,
Title,Corrosion-resistant and interfacial conductive AlTiVCrMo high-entropy alloy and (AlTiVCrMo)Nx high-entropy ceramics coatings for surface modification of bipolar plates in proton exchange membrane fuel cellsFirst,,
First,Yan W.,SCOPUS,Key Laboratory of Beam Technology of Ministry of Education College of Nuclear Science and Technology Beijing Normal University Beijing 100875 China Advanced Institute of Natural Sciences Beijing Normal University at Zhuhai Zhuhai 519087 China
Last,Liao B.,SCOPUS,Key Laboratory of Beam Technology of Ministry of Education College of Nuclear Science and Technology Beijing Normal University Beijing 100875 China Beijing Academy of Science and Technology Beijing 100875 China Advanced Institute of Natural Sciences Beijing Normal University at Zhuhai Zhuhai 519087 China
,,,
Title,Towards Replacing Titanium with Copper in the Bipolar Plates for Proton Exchange Membrane Water ElectrolysisFirst,,
First,"Kellenberger, Andrea",SCOPUS,Faculty of Industrial Chemistry and Environmental Engineering Politehnica University Timisoara Piata Victoriei No. 2 Timisoara 300006 Romania
Last,"Friedrich, K. Andreas",SCOPUS,Institute of Engineering Thermodynamics German Aerospace Center Pfaffenwaldring 30-40 Stuttgart 70569 Germany
,,,
Title,Materials in PEM Fuel CellsFirst,,
First,Baroutaji A.,SCOPUS,University of Wolverhampton Wolverhampton United Kingdom Cork Institute of Technology Cork Ireland Dublin City University Dublin Ireland
Last,"Olabi, Abdul Ghani",SCOPUS,University of Sharjah Sharjah United Arab Emirates Aston University Birmingham United Kingdom University of the West of Scotland Paisley United Kingdom
,,,
Title,Dataset and mesh of the CFD numerical model for the modelling and simulation of a PEM fuel cellFirst,,
First,"Iranzo, Alfredo",SCOPUS,Energy Engineering Department School of Engineering University of Seville Camino de los Descubrimientos s/n Seville 41092 Spain AICIA ? Thermal Engineering Group Camino de los Descubrimientos s/n Seville 41092 Spain
Last,"Pino, Javier",SCOPUS,Energy Engineering Department School of Engineering University of Seville Camino de los Descubrimientos s/n Seville 41092 Spain
,,,
Title,The effect of sarcopenia on outcomes following orthopaedic surgeryFirst,,
First,Brzeszczynski F.,SCOPUS,School of Health and Social Care Edinburgh Napier University Edinburgh United Kingdo
Last,"Hamilton, David F.",SCOPUS,School of Health and Social Care Edinburgh Napier University Edinburgh United Kingdom
,,,
Title,The hard x-ray nanotomography microscope at the advanced light sourceFirst,,
First,Nichols J.B.,SCOPUS,Advanced Light Source Lawrence Berkeley National Lab Berkeley CA  94720 United States Department of Mechanical Engineering University of Utah Salt Lake City UT  84112 United States
Last,Czabaj M.W.,SCOPUS,Department of Mechanical Engineering University of Utah Salt Lake City UT  84112 United States
,,,
Title,Influence of High-k Passivation Layer on Gate Field Plate AlGaN/GaN/AlGaN Double Heterojunction HEMTFirst,,
First,Natarajan R.,SCOPUS,Department of Electronics and Communication Engineering Anil Neerukonda Institute of Technology and Sciences Visakhapatnam India
Last,Murugapandiyan P.,SCOPUS,Department of Electronics and Communication Engineering Anil Neerukonda Institute of Technology and Sciences Visakhapatnam India
,,,
Title,Modeling and dynamic characteristic simulation of air-cooled proton exchange membrane fuel cell stack for unmanned aerial vehicleFirst,,
First,Gong C.,SCOPUS,School of Energy and Power Engineering Huazhong University of Science and Technology Wuhan 430074 China
Last,"Tu, Zhengkai",SCOPUS,School of Energy and Power Engineering Huazhong University of Science and Technology Wuhan 430074 China
,,,
Title,-30 C start-up of a PEFC stack based on alternate hydrogen pump method [????? -30 ??First,,
First,Si D.,SCOPUS,School of Vehicle and Mobility Tsinghua University Beijing 100084 China
Last,Zhang J.,SCOPUS,School of Vehicle and Mobility Tsinghua University Beijing 100084 China Beijing Institute of Technology Beijing Co-Innovation Center for Electric Vehicles Beijing 100081 China
,,,
Title,Investigation on forming methods in rubber pad forming process used for fabricating Cu/Ni clad foil microchannelFirst,,
First,Wang C.,SCOPUS,School of Materials Science and Engineering Harbin Institute of Technology at Weihai Weihai 264209 China Key Laboratory of Micro-Systems and Micro-Structures Manufacturing of Ministry of Education Harbin Institute of Technology Harbin 150080 China
Last,Zhang P.,SCOPUS,School of Materials Science and Engineering Harbin Institute of Technology at Weihai Weihai 264209 China Key Laboratory of Micro-Systems and Micro-Structures Manufacturing of Ministry of Education Harbin Institute of Technology Harbin 150080 China
,,,
Title,High drain-current-density and high breakdown-field Al0.36Ga0.64N-channel heterojunction field-effect transistors with a dual AlN/AlGaInN barrier layerFirst,,
First,Inoue A.,SCOPUS,Research Center for Nano Device and System Nagoya Institute of Technology Nagoya 466-8555 Japan
Last,"Miyoshi, Makoto",SCOPUS,Research Center for Nano Device and System Nagoya Institute of Technology Nagoya 466-8555 Japan Innovation Center for Multi-Business of Nitride Semiconductors Nagoya Institute of Technology Nagoya 466-8555 Japan
,,,
Title,Plasma surface technology for CO2-neutral and sustainable mobilityFirst,,
First,"Hosenfeldt, Tim",SCOPUS,Schaeffler AG Central Research and Technology Herzogenaurach Germany
Last,"Hosenfeldt, Tim",SCOPUS,Schaeffler AG Central Research and Technology Herzogenaurach Germany
,,,
Title,Effect of Repetitive Rates of Impulse Voltage on Electrical Tree in Silicone Resin for Inverter-fed Traction MotorFirst,,
First,Tang Y.,SCOPUS,Xi'An Jiaotong University State Key Laboratory of Electrical Insulation and Power Equipment Xi'an 710049 China
Last,Li D.,SCOPUS,CRRC Yongji Electric Co. Ltd. Xi'an 710016 China
,,,
Title,Simulation and experimental researches on multi-plate rubber pad forming of two-step micro-channel based on different forming driving modelsFirst,,
First,Teng F.,SCOPUS,Transportation Engineering College Dalian Maritime University No. 1 Linghai Road Ganjingzi District Liaoning Dalian 106026 China
Last,Zhang S.,SCOPUS,Shagang School of Iron and Steel Soochow University Suzhou 215002 China
,,,
Title,Low density of interface trap states and temperature dependence study of Ga2O3Schottky barrier diode with p-NiOxterminationFirst,,
First,Yan Q.,SCOPUS,State Key Discipline Laboratory of Wide Band Gap Semiconductor Technology School of Microelectronics Xidian University Xi'an 710071 China
Last,Hao Y.,SCOPUS,State Key Discipline Laboratory of Wide Band Gap Semiconductor Technology School of Microelectronics Xidian University Xi'an 710071 China
,,,
