Last,Lee C.-Y.,SCOPUS,Department of Refrigeration Air-Conditioning and Energy Engineering National Chin-Yi University of Technology Taichung City 411 Taiwan
,,,
Title,Cribriform CSF Leak: Endoscopic Surgical Repair Using Free Septal Mucosal Graft Without Postoperative Nasal PacksFirst,,
First,Ahilasamy N.,SCOPUS,ENT Centre Chennai Tamil Nadu  600 042 India
Last,Sivaprakasam R.,SCOPUS,ENT Centre Chennai Tamil Nadu  600 042 India
,,,
Title,Enhanced performance and durability of composite bipolar plate with surface modification of cactus-like carbon nanofibersFirst,,
First,"Jiang, Fengjing",SCOPUS,Institute of Fuel Cell School of Mechanical Engineering Shanghai Jiao Tong University 800 Dongchuan Rd. Shanghai 200240 China
Last,"Miyawaki, Jin",SCOPUS,Institute for Materials Chemistry and Engineering Kyushu University Kasuga Fukuoka  816-8580 Japan
,,,
Title,Corrosion resistance and electrical conductivity of plasma nitrided titaniumFirst,,
First,Shen H.,SCOPUS,Department of Materials Science and Engineering Dalian Maritime University Dalian 116026 China
Last,Wang L.,SCOPUS,Department of Materials Science and Engineering Dalian Maritime University Dalian 116026 China
,,,
Title,"Resistive switching behavior, mechanism and synaptic characteristics in TiO2 nanosheets grown on Ti plate by hydrothermal methodFirst",,
First,Wang H.,SCOPUS,Department of Materials Science and Engineering Taiyuan University of Technology Taiyuan 030024 China
Last,Han W.,SCOPUS,Department of Materials Science and Engineering Taiyuan University of Technology Taiyuan 030024 China
,,,
Title,Standardized testing framework for quality control of fuel cell bipolar platesFirst,,
First,Shaigan N.,SCOPUS,Energy Mining and Environment Research Centre National Research Council Canada Vancouver BC  V6T 1W5 Canada
Last,"Robertson, Mark",SCOPUS,Energy Mining and Environment Research Centre National Research Council Canada Vancouver BC  V6T 1W5 Canada
,,,
Title,Preparation of sidewall-insulation layer on micro-hollow electrodes for ECM by asymmetric-timed bipolar electrophoretic coating method and its applicationFirst,,
First,"Kong, Quancun",SCOPUS,School of Instrumentation Science and Opto-Electronics Engineering Beijing Information Science and Technology University Beijing 100192 China Department of Mechanical Engineering Tsinghua University Beijing 100084 China Institute of Precision Measuring Technology and Instruments Beijing Information Science &Technology University Beijing 100192 China
Last,Zhao S.Q.,SCOPUS,School of Instrumentation Science and Opto-Electronics Engineering Beijing Information Science and Technology University Beijing 100192 China
,,,
Title,Trace-metal contamination in proton exchange membrane fuel cells caused by laser-cutting stains on carbon-coated metallic bipolar platesFirst,,
First,Novalin T.,SCOPUS,Applied Electrochemistry School of Engineering Sciences in Chemistry Biotechnology and Health KTH Royal Institute of Technology Stockholm SE-100 44 Sweden
Last,"Lindstr?m, Rakel Wreland",SCOPUS,Applied Electrochemistry School of Engineering Sciences in Chemistry Biotechnology and Health KTH Royal Institute of Technology Stockholm SE-100 44 Sweden
,,,
Title,Investigation of physical and electrical properties of TiN-coated SS316L as bipolar plate of proton exchange membrane fuel cellsFirst,,
First,"Ghorbani, Mohammad Matboo",SCOPUS,Faculty of Chemical Materials Engineering Shahrood University of Technology Shahrood Iran
Last,Bozorg M.,SCOPUS,Faculty of Chemical Materials Engineering Shahrood University of Technology Shahrood Iran
,,,
Title,Performance of Nb0.8Zr0.2 Layer-Modified AISI430 Stainless Steel as Bipolar Plates for Direct Formic Acid Fuel CellsFirst,,
First,Liu Y.,SCOPUS,Inner Mongolia Key Laboratory of Coal Chemical Engineering and Comprehensive Utilization School of Chemistry and Chemical Engineering Inner Mongolia University of Science and Technology Baotou 014010 China School of Materials and Metallurgy Inner Mongolia University of Science and Technology Baotou 014010 China
Last,"An, Shengli",SCOPUS,School of Materials and Metallurgy Inner Mongolia University of Science and Technology Baotou 014010 China
,,,
Title,Dimensional tolerance analysis of proton exchange membrane fuel cells with metallic bipolar platesFirst,,
First,"Peng, Linfa",SCOPUS,State Key Laboratory of Mechanical System and Vibration Shanghai Jiao Tong University Shanghai 200240 China
Last,"Lai, Xinmin",SCOPUS,State Key Laboratory of Mechanical System and Vibration Shanghai Jiao Tong University Shanghai 200240 China Shanghai Key Laboratory of Digital Manufacture for Thin-walled Structures Shanghai Jiao Tong University Shanghai 200240 China
,,,
Title,Development and evaluation of nitride coated titanium bipolar plates for PEM fuel cellsFirst,,
First,Bi J.,SCOPUS,School of Metallurgical and Ecological Engineering University of Science and Technology Beijing 30 College Road Beijing 100083 China State Key Laboratory of Advanced Metallurgy School of Metallurgical and Ecological Engineering University of Science and Technology Beijing 30 College Road Beijing 100083 China
Last,"Wang, Xingdong",SCOPUS,School of Metallurgical and Ecological Engineering University of Science and Technology Beijing 30 College Road Beijing 100083 China State Key Laboratory of Advanced Metallurgy School of Metallurgical and Ecological Engineering University of Science and Technology Beijing 30 College Road Beijing 100083 China
,,,
Title,Recent advances in graphene-based materials for fuel cell applicationsFirst,,
First,"Su, Hanrui",SCOPUS,Department of Materials Science and Engineering Michigan Technological University Houghton MI United States
Last,"Hu, Yunhang",SCOPUS,Department of Materials Science and Engineering Michigan Technological University Houghton MI United States
,,,
Title,Synthesis and Ex-Situ characterizations of diamond-like carbon coatings for metallic bipolar plates in PEM fuel cellsFirst,,
First,"Alaefour, Ibrahim E.",SCOPUS,20/20 Laboratory for Fuel Cell and Green Energy RD&D Department of Mechanical and Mechatronics Engineering University of Waterloo Waterloo ON  N2L 3G1 Canada
Last,"Li, Xianguo",SCOPUS,20/20 Laboratory for Fuel Cell and Green Energy RD&D Department of Mechanical and Mechatronics Engineering University of Waterloo Waterloo ON  N2L 3G1 Canada
,,,
Title,Recent advances and future perspectives of carbon materials for fuel cellFirst,,
First,Saadat N.,SCOPUS,Centre for Biocomposites and Biomaterials Processing Division of Forestry Daniels Faculty of Architecture and Landscape Design University of Toronto Toronto Ontario Canada
Last,"Sain, Mohini M.",SCOPUS,Centre for Biocomposites and Biomaterials Processing Division of Forestry Daniels Faculty of Architecture and Landscape Design University of Toronto Toronto Ontario Canada Department of Mechanical and Industrial Engineering University of Toronto Toronto Ontario Canada
,,,
Title,Significant enhancement of corrosion resistance of stainless steel with nanostructured carbon coatings by substrate-catalytic CVDFirst,,
First,Shu S.,SCOPUS,Key Laboratory of Marine Materials and Related Technologies Zhejiang Key Laboratory of Marine Materials and Protective Technologies Ningbo Institute of Materials Technology and Engineering (NIMTE) Chinese Academy of Sciences Ningbo 315201 China Center of Materials Science and Optoelectronics Engineering University of Chinese Academy of Sciences Beijing 100049 China
Last,"Chin, Tsungshune",SCOPUS,Department of Materials Science and Engineering Feng Chia University Taichung 40724 Taiwan
,,,
Title,Metal-insert technique for polypropylene composite bipolar plate manufacturingFirst,,
First,"Yeetsorn, Rungsima",SCOPUS,Department of Mechanical and Process Engineering The Sirindhorn International Thai-German Graduate School of Engineering King Mongkut's University of Technology North Bangkok Bangkok 10800 Thailand
Last,"Maiket, Yaowaret",SCOPUS,Thai-French Innovation Institute King Mongkut's University of Technology North Bangkok Bangkok 10800 Thailand
,,,
Title,Performance assessment of gas crossover phenomenon and water transport mechanism in high pressure PEM electrolyzerFirst,,
First,"Afshari, Ebrahim",SCOPUS,Department of Mechanical Engineering Faculty of Engineering University of Isfahan Hezar-Jerib Ave.Isfahan  81746-73441 Iran
Last,"Toghyani, Somayeh",SCOPUS,Department of Mechanical Engineering Faculty of Engineering University of Isfahan Hezar-Jerib Ave.Isfahan  81746-73441 Iran
,,,
Title,"Effect of BaTiO3 templates on the electrical characteristics of (Ba, Ca)(Ti, Sn, Hf)-based ceramics under the reducing atmosphere for actuator applicationsFirst",,
First,Tsai C.-C.,SCOPUS,Department of Game and Animation Design TungFang Design University Kaohsiung 829 Taiwan
Last,Lin Y.-Y.,SCOPUS,Department of Electronic Engineering National Kaohsiung Normal University Kaohsiung 802 Taiwan
,,,
Title,"Retraction notice to: A review of composite and metallic bipolar plates in proton exchange membrane fuel cell: Materials, fabrication, and material selection. [J. Power Sources, 265, (1) 2014, 370?390] (Journal of Power Sources (2014) 265 (370?390), (S0378775314005825), (10.1016/j.jpowsour.2014.04.081)First",,
First,"Taherian, Reza",SCOPUS,Shahrood University Mechanical Engineering Department Iran
Last,"Taherian, Reza",SCOPUS,Shahrood University Mechanical Engineering Department Iran
,,,
Title,Parametric sensitivity analysis on the cold start process of a polymer electrolyte membrane fuel cellFirst,,
First,Niu H.,SCOPUS,College of Energy and Power Engineering Beijing Lab of New Energy Vehicles and Key Lab of Regional Air Pollution Control Beijing University of Technology Beijing University of Technology Beijing China
Last,Liang C.,SCOPUS,Beijing Automotive Technology Center Beijing China
,,,
Title,Graphite-epoxy composites for fuel-cell bipolar plates: Wet vs dry mixing and role of the design of experiment in the optimization of molding parametersFirst,,
First,"Roncaglia, Fabrizio",SCOPUS,Dipartimento Scienze Chimiche e Geologiche Universit? Modena e Reggio Emilia Via G. Campi 103 Modena 41125 Italy
Last,"Mucci, Adele",SCOPUS,Dipartimento Scienze Chimiche e Geologiche Universit? Modena e Reggio Emilia Via G. Campi 103 Modena 41125 Italy
,,,
Title,"Rapid Impedance Spectroscopy for Monitoring Tissue Impedance, Temperature, and Treatment Outcome during Electroporation-Based TherapiesFirst",,
First,Lorenzo M.F.,SCOPUS,Department of Biomedical Engineering and Mechanics Virginia Polytechnic Institute and State University Blacksburg VA United States
Last,"Davalos, Rafael Vidal",SCOPUS,Department of Biomedical Engineering and Mechanics Virginia Polytechnic Institute and State University Blacksburg VA United States
,,,
Title,An ultralight-weight polymer electrolyte fuel cell based on woven carbon fiber-resin reinforced bipolar plateFirst,,
First,Choi H.,SCOPUS,Fuel Cell Research and Demonstration Center Future Energy Research Division Korea Institute of Energy Research (KIER)Jeollabuk-do  56332 South Korea Department of Chemical Engineering Hanyang University Haengdang-dong Seongdong-gu Seoul 04763 South Korea
Last,"Jung, Chiyoung",SCOPUS,Fuel Cell Research and Demonstration Center Future Energy Research Division Korea Institute of Energy Research (KIER)Jeollabuk-do  56332 South Korea
,,,
Title,Proportion and morphological characteristics of human oligodendrocyte precursor cells in different cell culture vesselsFirst,,
First,Ye D.,SCOPUS,Department of Cell Biology and Neurobiology Xuzhou Medical University Xuzhou Jiangsu Province  221004 China Department of Pedistrics The Sixth Medical Center of Chinese PLA General Hospital Beijing 100048 China
Last,Yao R.,SCOPUS,Department of Cell Biology and Neurobiology Xuzhou Medical University Xuzhou Jiangsu Province  221004 China
,,,
Title,A novel high corrosion-resistant polytetrafluoroethylene/carbon cloth/Ag coating on magnesium alloys as bipolar plates for light-weight proton exchange membrane fuel cellsFirst,,
First,Yan P.,SCOPUS,National Engineering Research Center of Light Alloy Net Forming School of Materials Science and Engineering Shanghai Jiao Tong University Shanghai 200240 China
Last,"Ding, Wengjiang",SCOPUS,National Engineering Research Center of Light Alloy Net Forming School of Materials Science and Engineering Shanghai Jiao Tong University Shanghai 200240 China Center of Hydrogen Science Shanghai Jiao Tong University Shanghai 200240 China
,,,
Title,Sequential Vce(T) Method for the Accurate Measurement of Junction Temperature Distribution within Press-Pack IGBTsFirst,,
First,Zhang Y.,SCOPUS,State Key Laboratory of Alternate Electrical Power System with Renewable Energy Sources North China Electric Power University Beijing China
Last,"Cui, Xiang",SCOPUS,State Key Laboratory of Alternate Electrical Power System with Renewable Energy Sources North China Electric Power University Beijing China
,,,
Title,Fracture prediction in the stamping of titanium bipolar plate for PEM fuel cellsFirst,,
First,Modanloo V.,SCOPUS,Mechanical Engineering Department Faculty of Engineering Urmia University Urmia Iran
Last,Elyasi M.,SCOPUS,Mechanical Engineering Department Babol Noshirvani University of Technology Babol Iran
,,,
Title,Investigation and optimization of the ultra-thin metallic bipolar plate multi-stage forming for proton exchange membrane fuel cellFirst,,
First,Zhang R.,SCOPUS,State Key Laboratory of Mechanical System and Vibration Shanghai Jiao Tong University Shanghai 200240 China Shanghai Key Laboratory of Digital Manufacture for Thin-Walled Structures Shanghai Jiao Tong University Shanghai 200240 China
Last,"Peng, Linfa",SCOPUS,State Key Laboratory of Mechanical System and Vibration Shanghai Jiao Tong University Shanghai 200240 China Shanghai Key Laboratory of Digital Manufacture for Thin-Walled Structures Shanghai Jiao Tong University Shanghai 200240 China
,,,
Title,Effect of air contamination by sulfur dioxide on the high temperature PEM fuel cellFirst,,
First,Schonvogel D.,SCOPUS,German Aerospace Center Institute of Networked Energy Systems Germany
Last,"Dyck, Alexander",SCOPUS,German Aerospace Center Institute of Networked Energy Systems Germany
,,,
Title,Study of new flow field geometries to enhance water redistribution and pressure head losses reduction within PEM fuel cellFirst,,
First,Chadha K.,SCOPUS,Institut Pprime Universit? de Poitiers-CNRS-ENSMA UPR 3346 2 Rue Pierre Brousse B?timent B25 TSA 41105 Poitiers Cedex 9 F-86073 France
Last,"Thomas, Anthony",SCOPUS,Institut Pprime Universit? de Poitiers-CNRS-ENSMA UPR 3346 2 Rue Pierre Brousse B?timent B25 TSA 41105 Poitiers Cedex 9 F-86073 France
,,,
Title,Influences of plastic strain and strain rate on corrosion behavior of 316L stainless steel in simulated cathodic environment of proton exchange membrane fuel cellFirst,,
First,"Li, Dangguo",SCOPUS,State Key Laboratory of Tribology Tsinghua University Beijing 100084 China
Last,Liang P.,SCOPUS,State Key Laboratory of Tribology Tsinghua University Beijing 100084 China
,,,
Title,"Development, manufacture and validation of an open cathode LT-PEMFC stack at HySA systemsFirst",,
First,"Bujlo, Piotr",SCOPUS,Hydrogen South Africa (HySA) Systems Integration and Technology Validation Competence Centre University of the Western Cape Robert Sobukwe Road Cape Town Bellville  7535 South Africa
Last,"Pasupathi, Sivakumar",SCOPUS,Hydrogen South Africa (HySA) Systems Integration and Technology Validation Competence Centre University of the Western Cape Robert Sobukwe Road Cape Town Bellville  7535 South Africa
,,,
Title,Carbonized elastomer composite filled with hybrid carbon fillers for vanadium redox flow battery bipolar platesFirst,,
First,Ruban E.,SCOPUS,Institute of Problems of Chemical Physics RAS Acad. Semenov av. 1 Chernogolovka Moscow Region142432 Russian Federation Inenergy LLC 2-nd Kotlyakovskiy lane 18 Moscow 115201 Russian Federation
Last,Usenko A.,SCOPUS,Institute of Problems of Chemical Physics RAS Acad. Semenov av. 1 Chernogolovka Moscow Region142432 Russian Federation Inenergy LLC 2-nd Kotlyakovskiy lane 18 Moscow 115201 Russian Federation National University of Science and Technology MISIS Leninsky av. 4 Moscow 119049 Russian Federation
,,,
Title,Modeling and optimization of directly modulated piezoelectric micromachined ultrasonic transducersFirst,,
First,Pop F.,SCOPUS,Electrical and Computer Engineering Department Northeastern University Boston MA  02115 United States
Last,"Rinaldi, Matteo",SCOPUS,Electrical and Computer Engineering Department Northeastern University Boston MA  02115 United States
,,,
Title,Intergranular passivation of the TiC coating for enhancing corrosion resistance and surface conductivity in stainless-steel bipolar platesFirst,,
First,Li J.,SCOPUS,School of Materials Science and Hydrogen Energy Foshan University Foshan 528000 China Guangdong Key Laboratory for Hydrogen Energy Technologies Foshan 528000 China CAS Key Laboratory of Renewable Energy Guangzhou Institute of Energy Conversion Chinese Academy of Sciences Guangzhou 510640 China Guangdong Provincial Key Laboratory of New and Renewable Energy Research and Development Guangzhou 510640 China
Last,Liu C.,SCOPUS,School of Materials Science and Hydrogen Energy Foshan University Foshan 528000 China Guangdong Key Laboratory for Hydrogen Energy Technologies Foshan 528000 China
,,,
Title,Understanding size effects and forming limits in the micro-stamping of industrial stainless steel foilsFirst,,
First,Weiss M.,SCOPUS,Institute for Frontier Materials Deakin University Waurn Ponds Pigdons Rd Geelong VIC  3216 Australia
Last,"Hodgson, Peter D.",SCOPUS,Institute for Frontier Materials Deakin University Waurn Ponds Pigdons Rd Geelong VIC  3216 Australia
,,,
Title,A Build-In Data Inversion Method to Retrieve Aerosol Size Distributions for a Portable Ultrafine Particle Sizer (PUPSFirst,,
First,Yang J.,SCOPUS,Academy of Electronic Science and Applied Physics Hefei University of Technology Hefei China State Key Laboratory of Transducer Technology Institute of Intelligent Machines Chinese Academy of Sciences Hefei China
Last,Chen M.,SCOPUS,State Key Laboratory of Transducer Technology Institute of Intelligent Machines Chinese Academy of Sciences Hefei China Science Island Branch of Graduate School University of Science and Technology of China Hefei 230026 China
,,,
Title,Cryogenic amplification of image-charge detection for readout of quantum states of electrons on liquid heliumFirst,,
First,Elarabi A.,SCOPUS,Quantum Dynamics Unit Okinawa Institute of Science and Technology (OIST) Graduate University Tancha 1919-1 Onna-son Kunigami-gun Okinawa  904-0495 Japan
Last,Konstantinov D.,SCOPUS,Quantum Dynamics Unit Okinawa Institute of Science and Technology (OIST) Graduate University Tancha 1919-1 Onna-son Kunigami-gun Okinawa  904-0495 Japan
,,,
Title,A review of modified metal bipolar plates for proton exchange membrane fuel cellsFirst,,
First,Wu S.,SCOPUS,College of Mechanical and Electronic Engineering Beijing University of Chemical Technology Beijing 100029 China
Last,Chen H.,SCOPUS,College of Electromechanical Engineering Qingdao University of Science and Technology Qingdao 266061 China
,,,
Title,Performance study on a stepped flow field design for bipolar plate in PEMFCFirst,,
First,Chen X.,SCOPUS,College of Mechanical Engineering Hunan Institute of Science and Technology Yueyang 414006 China
Last,"Wang, Xiaodong",SCOPUS,Research Center of Engineering Thermophysics North China Electric Power University Beijing 102206 China
,,,
Title,"Electrical characteristics of a low-temperature, atmospheric-pressure helium plasma jetFirst",,
First,"Sakakita, Hajime",SCOPUS,Innovative Plasma Processing Group Research Institute for Advanced Electronics and Photonics National Institute of Advanced Industrial Science and Technology (AIST) Tsukuba Central 2 1-1-1 Umezono Tsukuba Ibaraki 305-8568 Japan
Last,"Kiyama, Sactoru",SCOPUS,Innovative Plasma Processing Group Research Institute for Advanced Electronics and Photonics National Institute of Advanced Industrial Science and Technology (AIST) Tsukuba Central 2 1-1-1 Umezono Tsukuba Ibaraki 305-8568 Japan
,,,
Title,Numerical analysis of static and dynamic heat transfer behaviors inside proton exchange membrane fuel cellFirst,,
First,Wang Q.,SCOPUS,School of Automotive Studies & Clean Energy Automotive Engineering Center Tongji University (Jiading Campus) 4800 Caoan Road Shanghai 201804 China
Last,"Ming, Pingwen",SCOPUS,School of Automotive Studies & Clean Energy Automotive Engineering Center Tongji University (Jiading Campus) 4800 Caoan Road Shanghai 201804 China
,,,
Title,Influence of Waveform of Applied Voltage on H2Production from Methane Reforming Using Dielectric Barrier DischargeFirst,,
First,Miura T.,SCOPUS,Faculty of Science and Engineering Iwate University Morioka Japan
Last,"Nishida, Yasushi",SCOPUS,Faculty of Science and Engineering Iwate University Morioka Japan
,,,
Title,Experimental performance investigation on the arrangement of metal foam as flow distributors in proton exchange membrane fuel cellFirst,,
First,Wan Z.,SCOPUS,College of Mechanical Engineering Hunan Institute of Science and Technology Yueyang 414006 Hunan China
Last,"Wang, Xiaodong",SCOPUS,Research Center of Engineering Thermophysics North China Electric Power University Beijing 102206 China
,,,
Title,The association of Plk1 with the astrin-kinastrin complex promotes formation and maintenance of a metaphase plateFirst,,
First,Geraghty Z.,SCOPUS,Sir William Dunn School of Pathology University of Oxford South Parks Road Oxford OX1 3RE United Kingdom
Last,Gruneberg U.,SCOPUS,Sir William Dunn School of Pathology University of Oxford South Parks Road Oxford OX1 3RE United Kingdom
,,,
Title,Electronic Transport and Corrosion Mechanisms of Graphite-Like Nanocrystalline Carbon Films Used on Metallic Bipolar Plates in Proton-Exchange Membrane Fuel CellsFirst,,
First,Zhang D.,SCOPUS,State Key Laboratory of Mechanical System and Vibration Shanghai Jiao Tong University Shanghai 200240 China
Last,"Lai, Xinmin",SCOPUS,State Key Laboratory of Mechanical System and Vibration Shanghai Jiao Tong University Shanghai 200240 China Shanghai Key Laboratory of Digital Manufacture for Thin-walled Structures Shanghai Jiao Tong University Shanghai 200240 China
,,,
Title,Surface modification of TA1 bipolar plate for proton exchange membrane fuel cellFirst,,
First,Han Y.,SCOPUS,Institute of Materials Technology Dalian Maritime University Dalian 116026 China
Last,"Sun, Juncai",SCOPUS,Institute of Materials Technology Dalian Maritime University Dalian 116026 China
,,,
Title,Involvement of Netrins and Their Receptors in Neuronal Migration in the Cerebral CortexFirst,,
First,Yamagishi S.,SCOPUS,Department of Organ and Tissue Anatomy Hamamatsu University School of Medicine Hamamatsu Japan
Last,Sato K.,SCOPUS,Department of Organ and Tissue Anatomy Hamamatsu University School of Medicine Hamamatsu Japan
,,,
Title,Progress in research and applications of Polyphenylene Sulfide blends and composites with carbonsFirst,,
First,Chen G.,SCOPUS,Bioproducts Discovery & Development Centre (BDDC) Department of Plant Agriculture University of Guelph Crop Science Building 50 Stone Road East Guelph Ontario N1G 2W1 Canada
Last,"Misra, Manjusri",SCOPUS,Bioproducts Discovery & Development Centre (BDDC) Department of Plant Agriculture University of Guelph Crop Science Building 50 Stone Road East Guelph Ontario N1G 2W1 Canada School of Engineering University of Guelph Thornbrough Building 50 Stone Road East Guelph Ontario N1G 2W1 Canada
,,,
Title,Novel Magnetic Flowable Electrode for Redox Flow Batteries: A Polysulfide/Iodide Case StudyFirst,,
First,Rahimi M.,SCOPUS,Department of Chemical and Petroleum Engineering Sharif University of Technology P.O. Box 11155-9465 Tehran Iran Department of Chemical and Petroleum Engineering University of Calgary 2500 University Drive NW Calgary T2N 1N4 Canada
Last,"Roberts, Edward P.L.",SCOPUS,Department of Chemical and Petroleum Engineering University of Calgary 2500 University Drive NW Calgary T2N 1N4 Canada
,,,
Title,Study effects of bio-inspired flow filed design on Polymer Electrolyte Membrane fuel cell performanceFirst,,
First,Ghadhban S.A.,SCOPUS,Middle Technical University Electrical Engineering Technical College Baghdad Iraq
Last,"Dhahad, Hayder Abed",SCOPUS,Mechanical Engineering Department University of Technology Baghdad Iraq
,,,
Title,A review of composite bipolar plates in proton exchange membrane fuel cells: Electrical properties and gas permeabilityFirst,,
First,Jeong K.I.,SCOPUS,Department of Mechanical Engineering Korea Advanced Institute of Science and Technology (KAIST) 291 Daehak-ro Yuseong-gu Daejeon South Korea
Last,"Kim, Seongsu",SCOPUS,Department of Mechanical Engineering Korea Advanced Institute of Science and Technology (KAIST) 291 Daehak-ro Yuseong-gu Daejeon South Korea
,,,
Title,Direct Phase-Change Cooling of Vapor Chamber Integrated with IGBT Power Electronic Module for Automotive ApplicationFirst,,
First,"Chen, Yiyi",SCOPUS,Dynex Semiconductor Ltd. Lincoln United Kingdom
Last,"Li, Helong",SCOPUS,Cree Europe Unterschleissheim Germany
,,,
Title,"A review of functions, attributes, properties and measurements for the quality control of proton exchange membrane fuel cell componentsFirst",,
First,"Yuan, Xiao Zi",SCOPUS,National Research Council Canada 4250 Wesbrook Mall Vancouver BC  V6T 1W5 Canada
Last,"Groos, Ulf",SCOPUS,Fraunhofer Institute for Solar Energy Systems Heidenhofstr. 2 Freiburg 79110 Germany
,,,
Title,High temperature proton exchange membrane fuel cells: Progress in advanced materials and key technologiesFirst,,
First,Haider R.,SCOPUS,Department of Chemical Engineering Shanghai Jiao Tong University Shanghai 200240 China
